title,field_address_address_line1,field_address_locality,field_address_administrative_area,field_address_postal_code,field_address_country_code,field_venue_type,field_short_description,field_phone,field_website_uri,field_website_title,field_cuisine,field_claimed_listing,field_image,image_search_hint,field_latitude,field_longitude
Tango's Ormond Beach,600 S Yonge St #16B,Ormond Beach,FL,32174,US,Restaurant,"Family-owned Latin American restaurant known for empanadas, grilled meats, and Argentine dishes.",(386) 281-3832,https://www.tangosob.com/,Official website,Argentine|Latin American,0,,Tangos Ormond exterior; Argentine restaurant Ormond,,
Margarita Island Ormond Beach,24 Ocean Shore Blvd,Ormond Beach,FL,32176,US,Restaurant,"Mexican restaurant near the beach serving tacos, burritos, fajitas, and margaritas.",(386) 944-9194,https://margaritaislandfl.com,Official website,Mexican,0,,Margarita Island Ormond exterior; Mexican Ocean Shore,,
La Hacienda Mexican Grill,2260 S Volusia Ave,Orange City,FL,32763,US,Restaurant,Orange City Mexican grill serving traditional dishes and margaritas.,(386) 851-0966,https://lahaciendamexicanfood.com/,Official website,Mexican,0,,La Hacienda Orange City exterior; Mexican grill Orange City,28.952255,-81.302367
El Tequila's Authentic Mexican Restaurant,1784 S Ridgewood Ave,South Daytona,FL,32119,US,Restaurant|Bar,"Family-owned Mexican restaurant with tamales, enchiladas, fajitas, and margaritas.",(386) 767-9512,https://www.eltequilassouthdaytona.com/,Official website,Mexican,0,,El Tequilas South Daytona exterior; Mexican restaurant Ridgewood,,
Cafe Con Leche,2761 S Ridgewood Ave,South Daytona,FL,32119,US,Cafe|Restaurant,South Daytona spot serving Cuban and Mexican dishes from breakfast through dinner.,(386) 999-0035,https://www.cafeconlechedaytona.com/,Official website,Cuban|Mexican,0,,Cafe Con Leche South Daytona exterior; Cuban Mexican South Daytona,,
Taqueria La Perla,1186 N Nova Rd,Holly Hill,FL,32117,US,Restaurant,Mexican restaurant in Holly Hill serving tacos and traditional dishes.,(386) 284-2328,https://taquerialaperlafl.com/,Official website,Mexican,0,,Taqueria La Perla Holly Hill exterior; tacos Holly Hill,,
Arroz Con Leche,1676 Ridgewood Ave,Holly Hill,FL,32117,US,Cafe|Restaurant,"Holly Hill restaurant serving Mexican and Cuban food, plus Puerto Rican specialties and breakfast.",(386) 492-4733,https://www.arrozconlechefl.com,Official website,Cuban|Mexican|Puerto Rican,0,,Arroz Con Leche Holly Hill exterior; Cuban Mexican Holly Hill,,
Sabor Latino Puerto Rican Cuisine & Gallery,777 Deltona Blvd,Deltona,FL,32725,US,Restaurant,Family-run Puerto Rican restaurant and gallery in Deltona.,(386) 742-7469,https://www.saborlatinodeltona.com/,Official website,Puerto Rican|Latin American,0,,Sabor Latino Deltona exterior; Puerto Rican Deltona,28.905564,-81.262441
El Molcajete Cocina Mexicana,2976 S Ridgewood Ave,Edgewater,FL,32141,US,Restaurant,"Edgewater Mexican restaurant serving fajitas, tacos, and lunch specials.",(386) 410-5840,https://linktr.ee/molcajeteofedgewater,Official website,Mexican,0,,El Molcajete Edgewater exterior; Mexican Edgewater,,
Mi Mexico Mexican Restaurant,4600 S Atlantic Ave,New Smyrna Beach,FL,32169,US,Restaurant,Beachside Mexican restaurant with full-service dining and patio seating.,,https://mimexiconsb.com,Official website,Mexican,0,,Mi Mexico NSB exterior; Mexican beachside,29.034516,-80.935541
Margarita Island New Smyrna Beach,1960 FL-44,New Smyrna Beach,FL,32168,US,Restaurant,Mexican restaurant in New Smyrna Beach serving classic dishes and margaritas.,(386) 402-4617,https://margaritaislandfl.com,Official website,Mexican,0,,Margarita Island NSB exterior; Mexican FL44,29.02141,-80.930341
Maiwi's Latin Fusion,314 Flagler Ave,New Smyrna Beach,FL,32169,US,Restaurant,Latin fusion restaurant on Flagler Avenue serving Cuban and Colombian-inspired dishes.,(386) 882-3098,,,Cuban|Colombian|Latin Fusion,0,,Maiwis Latin Fusion NSB exterior; Cuban Colombian Flagler,29.016475,-80.935555
Clancy's Cantina,301 Flagler Ave,New Smyrna Beach,FL,32169,US,Restaurant|Bar,"Long-running Tex-Mex restaurant on Flagler Avenue known for tacos, fajitas, and margaritas.",(386) 428-4500,https://www.clancyscantina.com/,Official website,Tex-Mex|Mexican,0,,Clancys Cantina NSB exterior; Tex Mex Flagler,29.020601,-80.933313
De La Vega,128 N Woodland Blvd,DeLand,FL,32720,US,Restaurant|Bar,"Downtown DeLand Latin-fusion restaurant known for tapas, sangria, and Latin-inspired plates.",(386) 734-4444,https://delavegart.com,Official website,Latin Fusion,0,,De La Vega DeLand exterior; Latin fusion DeLand,29.031453,-81.311155
Parva Colombian Restaurant & Bakery,1330 N Woodland Blvd,DeLand,FL,32720,US,Restaurant|Bakery,"Colombian restaurant and bakery serving breakfast, lunch, dinner, pastries, and coffee.",,https://www.toasttab.com/local/colombian-restaurant-bakery/r-60ec8bf7-5cee-4eab-a21b-40935d2d4341,Online ordering,Colombian|Bakery,0,,Parva Colombian DeLand exterior; Colombian bakery DeLand,29.021889,-81.312027
Dahlia Port Orange,1078 Dunlawton Ave,Port Orange,FL,32127,US,Restaurant,"Modern Mexican restaurant with tacos, steaks, birria, and cocktails.",(386) 238-9015,https://dahliamexicankitchen.com/port-orange,Official website,Mexican,0,,Dahlia Port Orange exterior; Mexican Dunlawton,29.14099,-80.985694
Ford's Garage Sanford,1415 Rinehart Rd,Sanford,FL,32771,US,Restaurant|Bar,Vintage-inspired burger restaurant and bar in Sanford known for craft beer and weekday happy hour.,321-249-3673,https://fordsgarageusa.com/locations/sanford-fl/,Official website,American|Burgers|Bar,0,,Fords Garage Sanford exterior; burgers craft beer Sanford,,
Carrabba's Italian Grill Sanford,4675 St. John's Pkwy,Sanford,FL,32771,US,Restaurant,"Sanford Italian grill serving pasta, steaks, cocktails, and a daily happy hour menu.",(407) 323-7868,https://locations.carrabbas.com/florida/sanford/4675-st.-john%27s-pkwy,Official website,Italian,0,,Carrabbas Sanford exterior; Italian restaurant Sanford,,
Brix & Mortar Sanford,117 S Palmetto Ave,Sanford,FL,32771,US,Restaurant|Wine Bar,Downtown Sanford wine bar and restaurant with small plates and Tuesday-Friday happy hour.,(407) 688-3078,https://thebestwineryever.com/pages/sanford,Official website,Wine Bar|Small Plates,0,,Brix and Mortar Sanford exterior; wine bar Sanford,,
The Station Bar & Grub,109 S Palmetto Ave,Sanford,FL,32771,US,Restaurant|Bar,"Historic Sanford sports bar with elevated pub food, cocktails, and a long happy hour window.",(407) 878-7433,https://www.thestationbarandgrub.com/,Official website,American|Sports Bar,0,,The Station Bar and Grub Sanford exterior; sports bar Sanford,,
The Yardery,415 E 4th St,Sanford,FL,32771,US,Restaurant|Bar,"Outdoor Sanford eatery and bar with yard games, casual bites, and weekday happy hour specials.",,https://www.theyardery.com/,Official website,American|Gastropub,0,,The Yardery Sanford exterior; outdoor bar Sanford,,
F&D Cantina Lake Mary,1125 Townpark Ave,Lake Mary,FL,32746,US,Restaurant|Bar,"Lake Mary Mexican cantina serving tacos, margaritas, and recurring happy hour specials.",(321) 384-3477,https://www.fdcantina.com/lake-mary-reservations,Official website,Mexican,0,,F and D Cantina Lake Mary exterior; tacos margaritas Lake Mary,,
Zacapa Mexican Restaurant & Bar,7025 Co Rd 46A #1011,Lake Mary,FL,32746,US,Restaurant|Bar,"Lake Mary Mexican restaurant and bar with margaritas, classic plates, and weekday happy hour.",(321) 926-3451,https://zacapamexicanrestaurantandbarfl.com/,Official website,Mexican,0,,Zacapa Mexican Restaurant Bar Lake Mary exterior; Mexican Lake Mary,,
The Hangry Bison Lake Mary,951 Market Promenade Ave #1115,Lake Mary,FL,32746,US,Restaurant|Bar,"Lake Mary gastropub known for burgers, bourbon, craft beer, and weekday happy hour.",(321) 363-3084,https://www.thehangrybison.com/,Official website,American|Gastropub,0,,Hangry Bison Lake Mary exterior; burgers bourbon Lake Mary,,
Boca Lake Mary,1145 Townpark Ave #1201,Lake Mary,FL,32746,US,Restaurant|Bar,"Farm-to-table Lake Mary restaurant with seasonal dishes, cocktails, and weekday happy hour.",,https://bocarestaurants.com/bocalakemary/,Official website,American|Farm-to-Table,0,,Boca Lake Mary exterior; farm to table Lake Mary,,
Stonewood Grill & Tavern Heathrow,1210 S International Pkwy,Heathrow,FL,32746,US,Restaurant|Bar,"Heathrow grill and tavern offering steaks, seafood, cocktails, and daily happy hour deals.",(407) 333-3292,https://www.stonewoodgrill.com/locations/heathrow/index,Official website,American|Steak|Seafood,0,,Stonewood Grill Tavern Heathrow exterior; happy hour Heathrow,,
Carrabba's Italian Grill Winter Springs,5820 Red Bug Lake Rd,Winter Springs,FL,32708,US,Restaurant,"Winter Springs Italian grill with pasta, cocktails, and a daily happy hour starting at $5.",(407) 696-6600,https://locations.carrabbas.com/florida/winter-springs/5820-red-bug-lake-road,Official website,Italian,0,,Carrabbas Winter Springs exterior; Italian restaurant Winter Springs,,
Ruth's Chris Steak House Lake Mary,80 Colonial Center Pkwy,Lake Mary,FL,32746,US,Restaurant|Bar,"Lake Mary steakhouse with cocktails, bar bites, and daily happy hour in the lounge.",(407) 804-8220,https://m.ruthschris.com/happy-hour/fl/lake-mary-restaurant/7336,Official website,Steakhouse,0,,Ruths Chris Lake Mary exterior; steakhouse Lake Mary,,
Prato,124 N Park Ave,Winter Park,FL,32789,US,Restaurant|Bar,"Winter Park Italian restaurant known for pizzas, aperitivos, and weekday happy hour.",,https://www.prato-wp.com/,Official website,Italian,0,,Prato Winter Park exterior; Italian restaurant Winter Park,,
Bar Louie Winter Park,460 Orlando Ave #122,Winter Park,FL,32789,US,Restaurant|Bar,"Winter Park Village bar and grill with flatbreads, cocktails, and weekday happy hour deals.",(407) 794-9500,https://www.barlouie.com/locations/us/fl/winter-park,Official website,American|Bar,0,,Bar Louie Winter Park exterior; happy hour Winter Park,,
Bar Italia Winter Park,480 Orlando Ave C-108,Winter Park,FL,32789,US,Restaurant|Bar,"Modern Italian restaurant in Winter Park Village with weekday happy hour on bites, pizzas, and drinks.",(407) 734-2290,https://baritalia.com/,Official website,Italian,0,,Bar Italia Winter Park exterior; Italian happy hour Winter Park,,
The Cheesecake Factory Winter Park,520 N Orlando Ave,Winter Park,FL,32789,US,Restaurant|Bar,Winter Park Village restaurant with a weekday bar-area happy hour on apps and cocktails.,(407) 644-4220,https://www.thecheesecakefactory.com/locations/fl/winter-park-135.html,Official website,American,0,,Cheesecake Factory Winter Park exterior; happy hour Winter Park,,
The Hangry Bison Winter Park,480 Orlando Ave #130,Winter Park,FL,32789,US,Restaurant|Bar,"Winter Park gastropub with burgers, whiskey, and weekday happy hour small plates and drinks.",(407) 677-5000,https://www.thehangrybison.com/,Official website,American|Gastropub,0,,Hangry Bison Winter Park exterior; burgers whiskey Winter Park,,
P.F. Chang's China Bistro Winter Park,436 N Orlando Ave,Winter Park,FL,32789,US,Restaurant|Bar,"Winter Park Asian restaurant with Lucky Eight Happy Hour on appetizers, dim sum, and cocktails.",(407) 622-0188,https://www.pfchangs.com/locations/us/fl/winter-park/436-n-orlando-ave/4202-winter-park.html,Official website,Chinese|Asian,0,,PF Changs Winter Park exterior; Asian restaurant Winter Park,,
Ruth's Chris Steak House Winter Park,480 N Orlando Ave Suite 100,Winter Park,FL,32789,US,Restaurant|Bar,"Winter Park steakhouse with cocktails, bar bites, and recurring happy hour specials.",(407) 622-2444,https://m.ruthschris.com/happy-hour/fl/winter-park-restaurant/7376,Official website,Steakhouse,0,,Ruths Chris Winter Park exterior; steakhouse happy hour Winter Park,,
Sakari Sushi,510 N Orlando Ave #104,Winter Park,FL,32789,US,Restaurant|Bar,Winter Park sushi restaurant with daily happy hour appetizers and drink specials.,(407) 644-5050,https://www.sakarisushi.com/,Official website,Japanese|Sushi,0,,Sakari Sushi Winter Park exterior; sushi happy hour Winter Park,,
Tommy Bahama Marlin Bar Winter Park,438 N Orlando Ave,Winter Park,FL,32789,US,Restaurant|Bar,Tropical-inspired Winter Park bar and restaurant with daily Island Time happy hour specials.,(689) 345-7935,https://www.tommybahama.com/restaurants-and-marlin-bars/locations/winter-park,Official website,Seafood|American|Bar,0,,Tommy Bahama Marlin Bar Winter Park exterior; cocktails Winter Park,,
Tabla Indian Restaurant,5847 Grand National Dr,Orlando,FL,32819,US,Restaurant|Bar,Orlando Indian restaurant on I-Drive offering a daily happy hour and modern Indian dishes.,(407) 248-9400,https://www.tablacuisine.com/,Official website,Indian,0,,Tabla Indian Restaurant Orlando exterior; Indian happy hour Orlando,28.532963,-81.38617
Shakai Sushi Lounge,43 E Pine St,Orlando,FL,32801,US,Restaurant|Bar,"Downtown Orlando sushi lounge with daily happy hour on drinks, rolls, and appetizers.",(407) 423-2688,https://www.shakaiorlando.com/,Official website,Japanese|Sushi,0,,Shakai Sushi Lounge Orlando exterior; sushi downtown Orlando,28.543489,-81.37303
BellaBrava Midtown Tampa,1015 Gramercy Ln,Tampa,FL,33607,US,Restaurant|Bar,Midtown Tampa Italian restaurant with an all-day-into-evening happy hour and patio seating.,(813) 524-5226,https://bellabrava.com/,Official website,Italian,0,,BellaBrava Midtown Tampa exterior; Italian restaurant Midtown Tampa,27.951315,-82.460086
True Food Kitchen Tampa,3645 Midtown Dr,Tampa,FL,33607,US,Restaurant|Bar,Health-focused Midtown Tampa restaurant with weekday happy hour on seasonal food and drinks.,(813) 327-4455,https://www.truefoodkitchen.com/locations/tampa/,Official website,American|Healthy,0,,True Food Kitchen Tampa exterior; Midtown Tampa happy hour,27.951102,-82.449656
Sal Y Mar Rooftop Bar,3650 Midtown Dr,Tampa,FL,33607,US,Restaurant|Bar,Rooftop Latin-inspired Tampa bar with weekday happy hour and skyline views.,(813) 692-3330,https://www.salymarrooftop.com/location/sal-y-mar/,Official website,Latin|Tapas|Bar,0,,Sal Y Mar Tampa rooftop exterior; happy hour Tampa,27.958757,-82.449803
Bella's Italian Cafe,1413 S Howard Ave,Tampa,FL,33606,US,Restaurant|Bar,South Tampa Italian restaurant with weekday drink specials and food deals at happy hour.,,https://www.bellasitaliancafe.com/,Official website,Italian,0,,Bellas Italian Cafe Tampa exterior; South Tampa Italian,27.949534,-82.461256
Bernini of Ybor,1702 E 7th Ave,Tampa,FL,33605,US,Restaurant|Bar,Ybor City Italian restaurant with daily happy hour cocktails and pasta specials.,,https://berniniofybor.com/,Official website,Italian,0,,Bernini of Ybor exterior; Italian happy hour Ybor,27.955387,-82.455626
Ava Tampa,718 S Howard Ave,Tampa,FL,33606,US,Restaurant|Bar,South Tampa Italian-inspired restaurant with weekday happy hour at the bar and lounge.,,https://www.avatampa.com/,Official website,Italian,0,,Ava Tampa exterior; Italian happy hour Tampa,27.947639,-82.449148
Bulla Gastrobar Tampa,930 S Howard Ave,Tampa,FL,33606,US,Restaurant|Bar,"Spanish gastropub in Tampa with daily happy hour on tapas, sangria, and cocktails.",,https://bullagastrobar.com/locations/tampa/,Official website,Spanish|Tapas,0,,Bulla Gastrobar Tampa exterior; tapas happy hour Tampa,27.956321,-82.448879
Green Lemon,915 S Howard Ave,Tampa,FL,33606,US,Restaurant|Bar,"Popular South Tampa Mexican spot with daily Fiesta Hour, tacos, and margaritas.",,https://www.eatgreenlemon.com/,Official website,Mexican,0,,Green Lemon Tampa exterior; tacos margaritas Tampa,27.959826,-82.455612
The Dan,905 N Florida Ave,Tampa,FL,33602,US,Restaurant|Bar,"Downtown Tampa restaurant with Sunday-Thursday happy hour on food, beer, wine, and cocktails.",,https://dineatthedan.com/,Official website,American,0,,The Dan Tampa exterior; downtown Tampa happy hour,27.943391,-82.456312
Haven,2208 W Morrison Ave,Tampa,FL,33606,US,Restaurant|Bar,Upscale South Tampa restaurant and wine bar with daily happy hour on bites and drinks.,,https://www.haventampa.com/,Official website,American|Wine Bar,0,,Haven Tampa exterior; wine bar South Tampa,27.94243,-82.455698
Timpano Hyde Park,1610 W Swann Ave,Tampa,FL,33606,US,Restaurant|Bar,Hyde Park Italian restaurant with weekday social hour and weekend happy hour specials.,,https://www.timpanohydepark.com/,Official website,Italian,0,,Timpano Hyde Park exterior; social hour Tampa,27.95375,-82.456233
The Hampton Social Orlando,9101 International Dr,Orlando,FL,32819,US,Restaurant|Bar,Coastal-inspired restaurant with popular happy hour and cocktails.,,https://www.thehamptonsocial.com,Official website,American|Seafood,0,,Hampton Social Orlando exterior; happy hour Orlando,28.546209,-81.37795
Cafe Tu Tu Tango,8625 International Dr,Orlando,FL,32819,US,Restaurant|Bar,Tapas-style dining with art and live entertainment.,,https://cafetututango.com,Official website,Tapas|Latin,0,,Cafe Tu Tu Tango Orlando tapas,28.54495,-81.381048
Tin Roof Orlando,8371 International Dr,Orlando,FL,32819,US,Bar|Restaurant,Live music bar with food and drink specials.,,https://tinrooforlando.com,Official website,American|Bar,0,,Tin Roof Orlando live music,28.535578,-81.377555
El Patron Restaurante Mexicano,12167 S Apopka Vineland Rd,Orlando,FL,32836,US,Restaurant,Mexican restaurant known for margaritas and happy hour.,,https://elpatronorlando.com,Official website,Mexican,0,,El Patron Orlando tacos margaritas,28.530903,-81.377426
Rocco's Tacos Orlando,7468 W Sand Lake Rd,Orlando,FL,32819,US,Restaurant|Bar,Popular taco spot with daily happy hour.,,https://www.roccostacos.com,Official website,Mexican|Tacos,0,,Roccos Tacos Orlando exterior,28.530201,-81.386214
Ole Red Orlando,8417 International Dr,Orlando,FL,32819,US,Restaurant|Bar,Country-themed restaurant with live music and specials.,,https://olered.com/orlando,Official website,American|Bar,0,,Ole Red Orlando live music,28.546717,-81.384243
Miller's Ale House Orlando I-Drive,8963 International Dr,Orlando,FL,32819,US,Restaurant|Bar,Sports bar with daily drink and food specials.,,https://millersalehouse.com,Official website,American|Sports Bar,0,,Millers Ale House Orlando I Drive,28.541093,-81.383306
Yard House Orlando,8367 International Dr,Orlando,FL,32819,US,Restaurant|Bar,Large beer selection with happy hour deals.,,https://yardhouse.com,Official website,American|Bar,0,,Yard House Orlando beers,28.542219,-81.373827
Bahama Breeze Orlando,8849 International Dr,Orlando,FL,32819,US,Restaurant|Bar,Caribbean restaurant with happy hour drinks.,,https://bahamabreeze.com,Official website,Caribbean,0,,Bahama Breeze Orlando exterior,28.537166,-81.381416
Uncle Julio's Orlando,8409 International Dr,Orlando,FL,32819,US,Restaurant,Tex-Mex restaurant with margarita specials.,,https://unclejulios.com,Official website,Tex-Mex,0,,Uncle Julios Orlando margaritas,28.533349,-81.384541
The Wharf at Sunset Walk,3274 Margaritaville Blvd,Kissimmee,FL,34747,US,Restaurant|Bar,Waterfront dining with live music and specials.,,https://thewharforlando.com,Official website,American|Seafood,0,,The Wharf Kissimmee sunset walk,,
Estefan Kitchen Orlando,3269 Margaritaville Blvd,Kissimmee,FL,34747,US,Restaurant,Cuban cuisine with music and drink specials.,,https://estefankitchen.com,Official website,Cuban,0,,Estefan Kitchen Kissimmee Cuban,,
El Jefe Tequilas Taco Cantina,3290 Margaritaville Blvd,Kissimmee,FL,34747,US,Restaurant|Bar,Mexican cantina with taco and tequila specials.,,https://eljefetequila.com,Official website,Mexican,0,,El Jefe Kissimmee tacos tequila,,
Mia's Italian Kitchen Orlando,8717 International Dr,Orlando,FL,32819,US,Restaurant|Bar,"Italian restaurant on I-Drive with weekday happy hour, pasta, pizza, and cocktails.",(407) 601-7130,https://orlando-fl.miasitalian.com/,Official website,Italian|Pizza|Bar,0,,Mias Italian Kitchen Orlando exterior; happy hour pasta pizza Orlando,28.544431,-81.371428
Tapa Toro Orlando,8441 International Dr,Orlando,FL,32819,US,Restaurant|Bar,Spanish tapas restaurant on I-Drive with daily happy hour and cocktail specials.,(407) 226-2929,https://tapatoro.restaurant/,Official website,Spanish|Tapas|Bar,0,,Tapa Toro Orlando exterior; tapas sangria happy hour Orlando,28.532885,-81.375734
Kings Dining & Entertainment Orlando,8255 International Dr Suite 120,Orlando,FL,32819,US,Bar|Restaurant,"Bowling, dining, and bar venue on I-Drive with weekday happy hour drink specials.",(407) 363-0200,https://www.playatkings.com/location/orlando/,Official website,American|Bar,0,,Kings Dining Orlando exterior; happy hour bowling bar Orlando,28.539706,-81.383577
Sports & Social Orlando,9101 International Dr,Orlando,FL,32819,US,Bar|Restaurant,Sports bar at Pointe Orlando with weekday happy hour and game-day atmosphere.,(407) 903-7951,https://liveatthepointeorlando.com/eat-and-drink/sports-and-social,Official website,American|Sports Bar,0,,Sports and Social Orlando exterior; happy hour sports bar Orlando,28.538766,-81.379864
Nueva Cantina Tampa,903 N Franklin St,Tampa,FL,33602,US,Restaurant|Bar,Downtown Tampa taco and margarita spot with weekday happy hour specials.,,https://nuevacantina.com/,Official website,Mexican|Tacos|Bar,0,,Nueva Cantina Tampa exterior; tacos margaritas downtown Tampa,27.949415,-82.456701
Margaritas Mexican Restaurant Tampa,209 Davis Blvd,Tampa,FL,33606,US,Restaurant|Bar,Davis Islands Mexican restaurant with weekday happy hour and weekend drink specials.,(813) 251-0558,https://www.margaritasmexicanrestaurant.com/,Official website,Mexican|Bar,0,,Margaritas Mexican Restaurant Tampa exterior; tacos margaritas Davis Islands,27.942908,-82.460129
Barrio Ybor City,1822 E 7th Ave,Tampa,FL,33605,US,Restaurant|Bar,Ybor City taco bar with Margarita Mondays and Taco + Tequila Tuesdays.,(813) 242-2452,https://barrio-tacos.com/locations/yborcity/,Official website,Mexican|Tacos|Bar,0,,Barrio Ybor City exterior; tacos margaritas Ybor Tampa,27.958812,-82.449239
Rocco's Tacos Tampa,2223 N Westshore Blvd Suite 203,Tampa,FL,33607,US,Restaurant|Bar,Mexican restaurant and tequila bar at International Plaza with daily happy hour and Taco Tuesday.,(813) 800-8226,https://www.roccostacos.com/tampa/,Official website,Mexican|Tacos|Bar,0,,Roccos Tacos Tampa exterior; happy hour tacos margaritas Tampa,27.960222,-82.453441
Mia's Italian Kitchen,8717 International Dr,Orlando,FL,32819,US,Restaurant|Bar,"Italian restaurant on International Drive serving housemade pasta, pizza, lunch, and a popular weekend bottomless brunch.",407-601-7130,https://orlando-fl.miasitalian.com,Official website,Italian|Brunch,0,,Mias Italian Kitchen Orlando exterior; Italian brunch International Drive,28.541751,-81.38034
Tapa Toro,8441 International Dr Suite 260,Orlando,FL,32819,US,Restaurant|Bar,"Spanish tapas restaurant at ICON Park known for paella, tapas, and Sunday brunch with flamenco.",407-226-2929,https://tapatoro.restaurant,Official website,Spanish|Tapas|Brunch,0,,Tapa Toro Orlando exterior; paella brunch ICON Park,28.530133,-81.373165
Kavas Tacos + Tequila,9101 International Dr Suite 1198,Orlando,FL,32819,US,Restaurant|Bar,"Pointe Orlando Mexican restaurant focused on tacos, brunch, and Taco Tuesday specials.",407-776-2027,https://kavastacos.com,Official website,Mexican|Tacos|Brunch,0,,Kavas Tacos Orlando exterior; brunch tacos Pointe Orlando,28.545629,-81.376502
Solita Tacos & Margaritas Orlando,222 S Orange Ave,Orlando,FL,32801,US,Restaurant|Bar,Downtown Orlando taco and margarita spot with Taco & Tequila Tuesday and weekend brunch.,407-698-4161,https://solitatacos.com/locations/orlando/,Official website,Mexican|Tacos|Brunch,0,,Solita Tacos Orlando exterior; downtown Orlando tacos brunch,28.536689,-81.370982
Hash House A Go Go Orlando,5350 International Dr,Orlando,FL,32819,US,Restaurant,Large-portion brunch and comfort-food restaurant on International Drive with weekend brunch offers.,407-370-4646,https://orlando.hashhouseagogo.com,Official website,American|Brunch|Breakfast,0,,Hash House A Go Go Orlando exterior; brunch International Drive,28.532871,-81.388731
Taverna Opa Orlando,9101 International Dr Suite 2240,Orlando,FL,32819,US,Restaurant|Bar,Greek and Mediterranean restaurant at Pointe Orlando with lively dining and a dedicated weekend brunch menu.,407-351-8660,https://opaorlando.com,Official website,Greek|Mediterranean|Brunch,0,,Taverna Opa Orlando exterior; Greek brunch Pointe Orlando,28.54104,-81.381388
House of Blues Restaurant & Bar Orlando,1490 E Buena Vista Dr,Orlando,FL,32830,US,Restaurant|Bar,"Disney Springs restaurant and bar serving Southern-inspired food, brunch, and live-music energy.",,https://locations.houseofblues.com/restaurant-and-bar/fl/orlando/1490-e-buena-vista-dr.,Official website,American|Southern|Brunch,0,,House of Blues Orlando exterior; brunch Disney Springs,28.535556,-81.375396
Urban Cantina,200 E Madison St,Tampa,FL,33602,US,Restaurant|Bar,"Downtown Tampa Mexican restaurant serving tacos, brunch, and Taco Tuesday specials.",813-221-8226,https://www.urbancantina.com/,Official website,Mexican|Tacos|Brunch,0,,Urban Cantina Tampa exterior; tacos brunch downtown Tampa,27.943132,-82.457321
Barrio Ybor City,1822 E 7th Ave,Tampa,FL,33605,US,Restaurant|Bar,Ybor City taco spot known for build-your-own tacos and Taco + Tequila Tuesday specials.,,https://barrio-tacos.com/locations/yborcity/,Official website,Mexican|Tacos,0,,Barrio Ybor City exterior; tacos Ybor Tampa,27.948205,-82.466519
Rocco's Tacos Tampa,2223 N Westshore Blvd Suite 203,Tampa,FL,33607,US,Restaurant|Bar,"Westshore Mexican restaurant with tacos, brunch, and Taco Tuesday specials.",813-800-8226,https://www.roccostacos.com/tampa/,Official website,Mexican|Tacos|Brunch,0,,Roccos Tacos Tampa exterior; tacos brunch Westshore,27.941972,-82.461731
